### ISSUE TITLE
P-CSCF crash during login(Boghe IMS client/SUBSCRIBE)

### ISSUE THREAD

**Issue by uts09** [kamailio/kamailio#1556]
### Description

Kamailio P-CSCF process is crashing during login. This issue is observed only on v5.1.4

#### Reproduction

Login using Boghe IMS client. Kamailio P-CSCF crashes and core file is generated. However process is not existing and subsequent login fails.

#### Debugging Data

```
#0  0x00007ff38ae9b568 in checkcontact (_m=0x7ff38cff86d8, c=0x7ff382ee0c78) at service_routes.c:133
        security_server_port = -1
        received_host = {s = 0x0, len = 0}
        srcip = "\340\210\377\214\363\177\000\000\200F\355\202\363\177\000\000\003\000\000\000\b\000\000\000\200F\355\202\363\177\000\000\027\003\000\000\027{Qm\220\002s_\374\177\000\000\000"
        __FUNCTION__ = "checkcontact"
#1  0x00007ff38ae9e5b5 in getContactP (_m=0x7ff38cff86d8, _d=0x7ff382ed4b88, reg_state=PCONTACT_REGISTERED, service_routes=0x0, num_service_routes=0)
    at service_routes.c:265
        p = 0x7ff382ee3c08
        b = 0x7ff38cfa7ef8
        ct = 0x7ff38cfb3110
        search_ci = {searchflag = 1, extra_search_criteria = 0, aor = {
            s = 0xa4755d <buf.6778+253> "sip:alice@127.0.0.1:55181;transport=udp>;+g.oma.sip-im;language=\"en,fr\"\r\nCall-ID: 80fd2441-bcf6-6744-2462-fe9d4443aff7\r\nCSeq: 24466 SUBSCRIBE\r\nExpires: 600000\r\nContent-Length: 0\r\nMax-Forwards: 69\r\nRou"..., len = 39}, via_host = {
            s = 0xa474b0 <buf.6778+80> "127.0.0.1:55181;branch=z9hG4bK22155406;rport\r\nFrom: <sip:alice@ims.mnc001.mcc001.3gppnetwork.org>;tag=22179732\r\nTo: <sip:alice@ims.mnc001.mcc001.3gppnetwork.org>\r\nContact: <sip:alice@127.0.0.1:55181;t"..., len = 9}, via_port = 55181, via_prot = 1, received_host = {
            s = 0x7ffc5f72d3f0 "10.0.3.2@\325r_\374\177", len = 8}, received_port = 55181, received_proto = 1, path = 0x0, expires = 0, callid = 0x0, 
          public_ids = 0x0, num_public_ids = 0, service_routes = 0x0, num_service_routes = 0, rx_regsession_id = 0x0, reg_state = PCONTACT_REGISTERED}
        received_host = {s = 0x7ffc5f72d3f0 "10.0.3.2@\325r_\374\177", len = 8}
        srcip = "10.0.3.2@\325r_\374\177", '\000' <repeats 18 times>, "P\324r_\374\177\000\000\332\000`\000\377\377\377\377\254", <incomplete sequence \324>
        vb = 0x7ff38cfdee10
        port = 55181
        proto = 1
        host = {
          s = 0xa474b0 <buf.6778+80> "127.0.0.1:55181;branch=z9hG4bK22155406;rport\r\nFrom: <sip:alice@ims.mnc001.mcc001.3gppnetwork.org>;tag=22179732\r\nTo: <sip:alice@ims.mnc001.mcc001.3gppnetwork.org>\r\nContact: <sip:alice@127.0.0.1:55181;t"..., len = 9}
        contact_uri = {user = {s = 0x2b8cfaa488 <Address 0x2b8cfaa488 out of bounds>, len = -2098315976}, passwd = {
            s = 0x400800000 <Address 0x400800000 out of bounds>, len = 8070400}, host = {s = 0x7ff38cff8d48 "", len = -1929409264}, port = {
            s = 0x7ffc5f72d410 "P\324r_\374\177", len = 6266277}, params = {s = 0x0, len = 0}, sip_params = {s = 0x7ffc5f72d340 "\001", len = 7124081}, headers = {
            s = 0x0, len = 8189296}, port_no = 0, proto = 0, type = 33, flags = (URI_USER_NORMALIZE | unknown: 10777708), transport = {s = 0x7ffc5f72d43c "", 
            len = 1601360976}, ttl = {s = 0x18cff8d48 <Address 0x18cff8d48 out of bounds>, len = 1601361216}, user_param = {s = 0x7ffc5f72d480 "\215\327\001", 
            len = 6266277}, maddr = {s = 0x2782ee0dba <Address 0x2782ee0dba out of bounds>, len = 10777942}, method = {s = 0x0, len = 0}, lr = {s = 0x0, 
            len = 1601362328}, r2 = {s = 0x1 <Address 0x1 out of bounds>, len = -2100498608}, gr = {s = 0x1986beae <Address 0x1986beae out of bounds>, len = 0}, 
          transport_val = {s = 0x182ccda98 <Address 0x182ccda98 out of bounds>, len = -2100498608}, ttl_val = {s = 0x7ffc5f72d3a0 "3\324r_\374\177", len = 6241268}, 
          user_param_val = {s = 0x7ff38cff8d10 "", len = -2100498608}, maddr_val = {s = 0x0, len = -2098315488}, method_val = {s = 0x7ffc5f72d433 "_\374\177", 
            len = -2098315528}, lr_val = {s = 0x5f72d43c <Address 0x5f72d43c out of bounds>, len = -2098315424}, r2_val = {s = 0x7ffc5f72d490 "", len = 6323521}, 
          gr_val = {s = 0x182ccb1b8 <Address 0x182ccb1b8 out of bounds>, len = -2098315528}}
        mustRetryViaSearch = 0
        mustRetryReceivedSearch = 0
        __FUNCTION__ = "getContactP"
        size = 1
        s_service_routes = {{s = 0x7ff382ee4024 "_sip._udp.ims.mnc001.mcc001.3gppnetwork.org", len = 7886160}}
        i = 0
#2  0x00007ff38aea8541 in is_registered (_m=0x7ff38cff86d8, _d=0x7ff382ed4b88) at service_routes.c:640
No locals.
#3  0x00007ff38ae9566c in w_is_registered (_m=0x7ff38cff86d8, _d=0x7ff382ed4b88 "\210J\355\202\363\177", _foo=0x0) at ims_registrar_pcscf_mod.c:426
No locals.
#4  0x000000000043655f in do_action (h=0x7ffc5f72dd30, a=0x7ff38cfbdc88, msg=0x7ff38cff86d8) at core/action.c:1073
        ret = -5
        v = 8358676
        dst = {send_sock = 0x75f72da50, to = {s = {sa_family = 0, sa_data = "\000\000\000\000\000\000\022\213\177\000\000\000\000"}, sin = {sin_family = 0, 
              sin_port = 0, sin_addr = {s_addr = 0}, sin_zero = "\022\213\177\000\000\000\000"}, sin6 = {sin6_family = 0, sin6_port = 0, sin6_flowinfo = 0, 
              sin6_addr = {__in6_u = {__u6_addr8 = "\022\213\177", '\000' <repeats 12 times>, __u6_addr16 = {35602, 127, 0, 0, 0, 0, 0, 0}, __u6_addr32 = {8358674, 0, 
                    0, 0}}}, sin6_scope_id = 1}}, id = 0, proto = 112 'p', send_flags = {f = 0, blst_imask = 0}}
        tmp = 0x7ff382ebc558 ""
        new_uri = 0x0
        end = 0x0
        crt = 0x1 <Address 0x1 out of bounds>
        cmd = 0x7ff38cf8ca58
        len = 0
        user = -1981233536
        uri = {user = {s = 0x800000 <yy_ec+512> "\001", len = 7547696}, passwd = {s = 0x6ecb8 <Address 0x6ecb8 out of bounds>, len = 840912}, host = {
            s = 0xcf6f8 <Address 0xcf6f8 out of bounds>, len = 8}, port = {s = 0x0, len = 6935974}, params = {s = 0x7ffc5f72d910 " \337r_\374\177", len = 8358676}, 
          sip_params = {s = 0x7ffc5f72df10 "", len = -1917923168}, headers = {s = 0x7ffc5f72e088 "", len = 8358674}, port_no = 57120, proto = 24434, type = 32764, 
          flags = (URI_USER_NORMALIZE | URI_SIP_USER_PHONE | unknown: 2373395928), transport = {s = 0x8 <Address 0x8 out of bounds>, len = -2098379136}, ttl = {
            s = 0x7ffc5f72da30 "\022\213\177", len = 6767209}, user_param = {s = 0x7dd450 "core", len = 5653152}, maddr = {s = 0x0, len = -1929695136}, method = {
            s = 0x3a70697300a477aa <Address 0x3a70697300a477aa out of bounds>, len = 10777936}, lr = {s = 0x7ffc5f72da90 "", len = -1921552019}, r2 = {
            s = 0x7dd450 "core", len = 0}, gr = {s = 0x0, len = -1}, transport_val = {s = 0xa00000000 <Address 0xa00000000 out of bounds>, len = 0}, ttl_val = {
            s = 0x7e0420 "(): failed to locate end of headers (%p %p - %d %d [%s])\n", len = 0}, user_param_val = {s = 0x0, len = 0}, maddr_val = {
            s = 0x7ffc5f72ded7 "0؆\377\214\363\177", len = 0}, method_val = {s = 0x7ffc00000000 <Address 0x7ffc00000000 out of bounds>, len = 0}, lr_val = {s = 0x0, 
            len = -1}, r2_val = {s = 0x7ff38d77716d <vfprintf+19661> "\200\275\360\372\377\377", len = 0}, gr_val = {s = 0x53 <Address 0x53 out of bounds>, 
            len = -1929540944}}
        next_hop = {user = {s = 0x7ff300000000 <Address 0x7ff300000000 out of bounds>, len = 6800784}, passwd = {s = 0x7ffc5f72d770 "", len = -1930260464}, host = {
            s = 0x799a40 "core", len = -1930260464}, port = {s = 0x7ffc5f72d7b0 "\340\327r_\374\177", len = -1985734390}, params = {
            s = 0x38 <Address 0x38 out of bounds>, len = 0}, sip_params = {s = 0x800000 <yy_ec+512> "\001", len = 7549424}, headers = {
            s = 0x6f430 <Address 0x6f430 out of bounds>, len = 839184}, port_no = 63224, proto = 12, type = ERROR_URI_T, flags = (unknown: 8), transport = {
            s = 0x13 <Address 0x13 out of bounds>, len = 1}, ttl = {s = 0x7ffc5f72d7e0 "@\330r_\374\177", len = 6800784}, user_param = {s = 0x7ffc5f72d800 "", 
            len = -1930260464}, maddr = {s = 0x300000000 <Address 0x300000000 out of bounds>, len = -1930260464}, method = {s = 0x7ffc5f72d840 "\320\330r_\374\177", 
            len = -1985734390}, lr = {s = 0x7ff38cf7bd28 "\330J\376\214\363\177", len = 0}, r2 = {s = 0x800000 <yy_ec+512> "\001", len = 7550280}, gr = {
            s = 0x6f0d8 <Address 0x6f0d8 out of bounds>, len = 838328}, transport_val = {s = 0x2f00000072 <Address 0x2f00000072 out of bounds>, len = 10778491}, 
          ttl_val = {s = 0x1d <Address 0x1d out of bounds>, len = 10778538}, user_param_val = {s = 0x7ffc5f72d8d0 "", len = 6928879}, maddr_val = {s = 0x0, 
            len = 6800784}, method_val = {s = 0x7ffc5f72d8a0 "", len = 6812479}, lr_val = {s = 0x7ffc5f72d990 "", len = -1930260464}, r2_val = {
            s = 0x7ffc5f72d8e0 "\020\331r_\374\177", len = -1985734390}, gr_val = {s = 0x7ffc5f72dbac "", len = 0}}
        u = 0x7ffc5f72dc40
        port = 0
        dst_host = 0x7ffc5f72dc80
        i = 600000
        flags = 32755
        avp = 0x0
        st = {flags = 2640, id = 0, name = {n = 1194, s = {s = 0x4aa <Address 0x4aa out of bounds>, len = 1601361920}, re = 0x4aa}, avp = 0x673ea5 <qm_malloc+1418>}
        sct = 0x0
        sjt = 0x0
        rve = 0x0
        mct = 0x0
        rv = 0x7cf570
        rv1 = 0x0
        c1 = {cache_type = 8193499, val_type = RV_NONE, c = {avp_val = {n = 7899258, s = {s = 0x78887a "core: core/msg_translator.c", len = 1472}, re = 0x78887a}, 
            pval = {rs = {s = 0x78887a "core: core/msg_translator.c", len = 1472}, ri = -2098312352, flags = 32755}}, 
          i2s = "\000\220Ă\363\177\000\000\252\004\000\000\000\000\000\000\210Q\356\202\004"}
        s = {s = 0x673908 <split_frag+301> "\270", len = 7899258}
        srevp = {0x0, 0x7ff38cff86d8}
        evp = {data = 0x0, rcv = 0x0, dst = 0x0}
        mod_f_params = {{type = NOSUBTYPE, u = {number = 0, string = 0x0, str = {s = 0x0, len = 0}, data = 0x0, attr = 0x0, select = 0x0}}, {type = NOSUBTYPE, u = {
              number = 0, string = 0x0, str = {s = 0x0, len = 0}, data = 0x0, attr = 0x0, select = 0x0}}, {type = NOSUBTYPE, u = {number = 0, string = 0x0, str = {
                s = 0x0, len = 0}, data = 0x0, attr = 0x0, select = 0x0}}, {type = NOSUBTYPE, u = {number = 0, string = 0x0, str = {s = 0x0, len = 0}, data = 0x0, 
              attr = 0x0, select = 0x0}}, {type = NOSUBTYPE, u = {number = 0, string = 0x0, str = {s = 0x0, len = 0}, data = 0x0, attr = 0x0, select = 0x0}}, {
            type = NOSUBTYPE, u = {number = 0, string = 0x0, str = {s = 0x0, len = 0}, data = 0x0, attr = 0x0, select = 0x0}}, {type = NOSUBTYPE, u = {number = 0, 
              string = 0x0, str = {s = 0x0, len = 0}, data = 0x0, attr = 0x0, select = 0x0}}, {type = NOSUBTYPE, u = {number = 0, string = 0x0, str = {s = 0x0, 
                len = 0}, data = 0x0, attr = 0x0, select = 0x0}}}
        __FUNCTION__ = "do_action"
#5  0x0000000000442c8a in run_actions (h=0x7ffc5f72dd30, a=0x7ff38cfbdc88, msg=0x7ff38cff86d8) at core/action.c:1565
        t = 0x7ff38cfbdc88
        ret = -1
        mod = 0x7ff389a4190a <pkg_proc_update_stats+115>
        ms = 0
        __FUNCTION__ = "run_actions"
#6  0x0000000000443367 in run_actions_safe (h=0x7ffc5f72f760, a=0x7ff38cfbdc88, msg=0x7ff38cff86d8) at core/action.c:1633
        ctx = {rec_lev = 1, run_flags = 0, last_retcode = 0, jmp_env = {{__jmpbuf = {140683850368640, -3424828827772609747, 4292624, 140721909858960, 0, 0, 
                -3424828827734861011, 3422786561839504173}, __mask_was_saved = 0, __saved_mask = {__val = {0, 26027501813760, 140721909849936, 10778163, 39, 8246352, 
                  3206242259672, 8258702, 8247512, 56, 140684018487312, 242119532256, 30064771073, 17184135084, 140684019171712, 0}}}}}
        ret = -1930260464
        ign_on_break = 0
#7  0x000000000063e344 in rval_get_int (h=0x7ffc5f72f760, msg=0x7ff38cff86d8, i=0x7ffc5f72e1b8, rv=0x7ff38cfbe430, cache=0x0) at core/rvalue.c:912
        r_avp = 0x3000000000000000
        avp_val = {n = 0, s = {s = 0x0, len = 0}, re = 0x0}
        pval = {rs = {s = 0x7ffc5f72dec0 "`\341r_\374\177", len = -2098379136}, ri = 4292624, flags = 0}
        tmp = {s = 0x0, len = -1929576008}
        s = 0x0
        r = 32755
        ret = 0
        destroy_pval = 0
        __FUNCTION__ = "rval_get_int"
#8  0x00000000006428db in rval_expr_eval_int (h=0x7ffc5f72f760, msg=0x7ff38cff86d8, res=0x7ffc5f72e1b8, rve=0x7ff38cfbe428) at core/rvalue.c:1910
        i1 = 0
        i2 = 0
        ret = -1
        c1 = {cache_type = 10778208, val_type = RV_NONE, c = {avp_val = {n = 2, s = {s = 0x2 <Address 0x2 out of bounds>, len = 0}, re = 0x2}, pval = {rs = {
                s = 0x2 <Address 0x2 out of bounds>, len = 0}, ri = 0, flags = 0}}, i2s = '\000' <repeats 21 times>}
        c2 = {cache_type = RV_CACHE_EMPTY, val_type = RV_NONE, c = {avp_val = {n = 0, s = {s = 0x0, len = 0}, re = 0x0}, pval = {rs = {s = 0x0, len = 0}, ri = 0, 
              flags = 0}}, i2s = '\000' <repeats 21 times>}
        rv1 = 0x0
        rv2 = 0x0
        __FUNCTION__ = "rval_expr_eval_int"
#9  0x0000000000642d19 in rval_expr_eval_int (h=0x7ffc5f72f760, msg=0x7ff38cff86d8, res=0x7ffc5f72e660, rve=0x7ff38cfbeb58) at core/rvalue.c:1918
        i1 = 1601372816
        i2 = 0
        ret = -1
        c1 = {cache_type = 1528904540, val_type = RV_NONE, c = {avp_val = {n = 0, s = {s = 0x0, len = -1930022920}, re = 0x0}, pval = {rs = {s = 0x0, 
                len = -1930022920}, ri = -1929410856, flags = 32755}}, i2s = "\020\200A\000\001\000\000\000\220\002s_\374\177\000\000\000\000\000\000\000"}
        c2 = {cache_type = 39, val_type = RV_NONE, c = {avp_val = {n = -2098379136, s = {s = 0x7ff382ed4680 "&>", len = 4292624}, re = 0x7ff382ed4680}, pval = {rs = {
                s = 0x7ff382ed4680 "&>", len = 4292624}, ri = 1601372816, flags = 32764}}, i2s = '\000' <repeats 16 times>, "\320\341r_\374\177"}
        rv1 = 0x7ff38cfb3060
        rv2 = 0x100000000
        __FUNCTION__ = "rval_expr_eval_int"
#10 0x0000000000435fb2 in do_action (h=0x7ffc5f72f760, a=0x7ff38cfbf560, msg=0x7ff38cff86d8) at core/action.c:1043
        ret = -5
        v = 1601365648
        dst = {send_sock = 0x7ffc5f72e7a0, to = {s = {sa_family = 1, sa_data = "\000\000\t\000\000\000\000\000\000\000>\000\000"}, sin = {sin_family = 1, 
              sin_port = 0, sin_addr = {s_addr = 9}, sin_zero = "\000\000\000\000>\000\000"}, sin6 = {sin6_family = 1, sin6_port = 0, sin6_flowinfo = 9, sin6_addr = {
                __in6_u = {__u6_addr8 = "\000\000\000\000>\000\000\000p0\373\214\363\177\000", __u6_addr16 = {0, 0, 62, 0, 12400, 36091, 32755, 0}, __u6_addr32 = {0, 
                    62, 2365272176, 32755}}}, sin6_scope_id = 1601365856}}, id = 32764, proto = 56 '8', send_flags = {f = 0, blst_imask = 0}}
        tmp = 0xa477a8 <buf.6778+840> "\r\n"
        new_uri = 0x0
        end = 0x0
        crt = 0x7ff38cfb3060 ")v\244"
        cmd = 0x7ff38cf89960
        len = 32755
        user = -1929539976
        uri = {user = {s = 0x800000000 <Address 0x800000000 out of bounds>, len = -1983389520}, passwd = {s = 0x7ffc5f72e630 "\240\347r_\374\177", len = 6564059}, 
          host = {s = 0x7ffc5f72e550 "R", len = 6800784}, port = {s = 0x7ffc5f72e520 "", len = -1930260464}, params = {s = 0x7ff382ed4b88 "\210J\355\202\363\177", 
            len = -1930260464}, sip_params = {s = 0x7ffc5f72e560 "\220\345r_\374\177", len = -1985734390}, headers = {s = 0x7ff38cfb0e70 "\205\002", len = 0}, 
          port_no = 0, proto = 128, type = ERROR_URI_T, flags = (unknown: 7547600), transport = {s = 0x6ed18 <Address 0x6ed18 out of bounds>, len = 841008}, ttl = {
            s = 0xcf6f8 <Address 0xcf6f8 out of bounds>, len = 8}, user_param = {s = 0x52 <Address 0x52 out of bounds>, len = -1929695192}, maddr = {
            s = 0x7ffc5f72e590 "\220\346r_\374\177", len = 5653152}, method = {s = 0x0, len = 8189296}, lr = {s = 0x0, len = -2098379136}, r2 = {
            s = 0x7ffc5f72e690 "\260\347r_\374\177", len = 6767209}, gr = {s = 0x7eb410 "core", len = 1601369952}, transport_val = {s = 0x0, len = -1}, ttl_val = {
            s = 0x7ff382ed4680 "&>", len = -786916563}, user_param_val = {s = 0x418010 <_start> "1\355I\211\321^H\211\342H\203\344\360PTI\307\300p\212t", 
            len = 1601372816}, maddr_val = {s = 0x0, len = -1929410856}, method_val = {s = 0x7ff38cfa0f00 "\364\001", len = 1601367232}, lr_val = {
            s = 0x7eb410 "core", len = 0}, r2_val = {s = 0x7ec5d0 <__FUNCTION__.5981> "do_parse_rr_body", len = 8303870}, gr_val = {
            s = 0x48 <Address 0x48 out of bounds>, len = -1930260464}}
        next_hop = {user = {s = 0x7ffc5f72e3b0 "\300\344r_\374\177", len = 5920448}, passwd = {s = 0x7ff38aec4e51 <__FUNCTION__.13206> "save", len = -1964225035}, 
          host = {s = 0x7ff38cfd8ae8 "\365u\244", len = 1601365040}, port = {s = 0x7ff38cfaa538 "\024", len = -1929410856}, params = {
            s = 0x7ff38cf8ad48 "\037Qt\213\363\177", len = 0}, sip_params = {s = 0x7ffc5f72e3b0 "\300\344r_\374\177", len = -2098379136}, headers = {
            s = 0x7ffc5f72e758 "", len = -1929410856}, port_no = 51584, proto = 36090, type = 32755, flags = (unknown: 1601365056), transport = {
            s = 0x7ffc5f72e4c0 "0\346r_\374\177", len = 0}, ttl = {s = 0x7ff38cf9da00 "", len = -1929410856}, user_param = {
            s = 0xffffffff00000000 <Address 0xffffffff00000000 out of bounds>, len = -1929782784}, maddr = {s = 0x7ffc5f72e4d0 "P\345r_\374\177", len = -2098379136}, 
          method = {s = 0x418010 <_start> "1\355I\211\321^H\211\342H\203\344\360PTI\307\300p\212t", len = 1601372816}, lr = {s = 0x0, len = 0}, r2 = {
            s = 0x7ffc5f72ea30 "P\352r_\374\177", len = 4416863}, gr = {s = 0x418010 <_start> "1\355I\211\321^H\211\342H\203\344\360PTI\307\300p\212t", 
            len = -1929410856}, transport_val = {s = 0x7ff38cfac980 "{\002", len = 1601369952}, ttl_val = {s = 0x0, len = -1}, user_param_val = {
            s = 0x7ff382ed4680 "&>", len = -768042195}, maddr_val = {s = 0x418010 <_start> "1\355I\211\321^H\211\342H\203\344\360PTI\307\300p\212t", 
            len = -2098379136}, method_val = {s = 0x418010 <_start> "1\355I\211\321^H\211\342H\203\344\360PTI\307\300p\212t", len = -1929410856}, lr_val = {
            s = 0x7ff38cf9dfc0 "\353\001", len = 1601366864}, r2_val = {s = 0x0, len = 0}, gr_val = {s = 0x0, len = 1601372816}}
        u = 0x800000 <yy_ec+512>
        port = 0
        dst_host = 0x418010 <_start>
        i = 0
        flags = 0
        avp = 0x0
        st = {flags = 4292624, id = 0, name = {n = 1601372816, s = {s = 0x7ffc5f730290 "\003", len = 0}, re = 0x7ffc5f730290}, avp = 0x0}
        sct = 0x7ff38cface00
        sjt = 0x6cf5a2 <do_parse_rr_body+2387>
        rve = 0x7ff38cfbeb58
        mct = 0x7ffc5f72e7b0
        rv = 0x7ff382ed4680
        rv1 = 0x6d0758 <parse_rr+711>
        c1 = {cache_type = 1601364752, val_type = 32764, c = {avp_val = {n = 1601365040, s = {s = 0x7ffc5f72e430 "\200\311\372\214\363\177", len = -1929730736}, 
              re = 0x7ffc5f72e430}, pval = {rs = {s = 0x7ffc5f72e430 "\200\311\372\214\363\177", len = -1929730736}, ri = -1929410856, flags = 32755}}, 
          i2s = "0\343r_\374\177\000\000<_z\214\363\177\000\000\020\200A\000\000"}
        s = {s = 0x300000000 <Address 0x300000000 out of bounds>, len = -2098379136}
        srevp = {0x7ffc5f72e3b0, 0x443367 <run_actions_safe+151>}
        evp = {data = 0x0, rcv = 0x0, dst = 0x0}
        mod_f_params = {{type = NOSUBTYPE, u = {number = 0, string = 0x0, str = {s = 0x0, len = 0}, data = 0x0, attr = 0x0, select = 0x0}}, {type = NOSUBTYPE, u = {
              number = 0, string = 0x0, str = {s = 0x0, len = 0}, data = 0x0, attr = 0x0, select = 0x0}}, {type = NOSUBTYPE, u = {number = 0, string = 0x0, str = {
                s = 0x0, len = 0}, data = 0x0, attr = 0x0, select = 0x0}}, {type = NOSUBTYPE, u = {number = 0, string = 0x0, str = {s = 0x0, len = 0}, data = 0x0, 
              attr = 0x0, select = 0x0}}, {type = NOSUBTYPE, u = {number = 0, string = 0x0, str = {s = 0x0, len = 0}, data = 0x0, attr = 0x0, select = 0x0}}, {
            type = NOSUBTYPE, u = {number = 0, string = 0x0, str = {s = 0x0, len = 0}, data = 0x0, attr = 0x0, select = 0x0}}, {type = NOSUBTYPE, u = {number = 0, 
              string = 0x0, str = {s = 0x0, len = 0}, data = 0x0, attr = 0x0, select = 0x0}}, {type = NOSUBTYPE, u = {number = 0, string = 0x0, str = {s = 0x0, 
                len = 0}, data = 0x0, attr = 0x0, select = 0x0}}}
        __FUNCTION__ = "do_action"
#11 0x0000000000442c8a in run_actions (h=0x7ffc5f72f760, a=0x7ff38cfbd8a0, msg=0x7ff38cff86d8) at core/action.c:1565
        t = 0x7ff38cfbf560
        ret = 1
        mod = 0x674269 <qm_malloc+2382>
        ms = 0
        __FUNCTION__ = "run_actions"
#12 0x0000000000432f32 in do_action (h=0x7ffc5f72f760, a=0x7ff38cfa4db8, msg=0x7ff38cff86d8) at core/action.c:691
        ret = -5
        v = 0
        dst = {send_sock = 0x7ff38cfadfe8, to = {s = {sa_family = 36880, sa_data = "\362\214\363\177\000\000\200F\355\202\363\177\000"}, sin = {sin_family = 36880, 
              sin_port = 36082, sin_addr = {s_addr = 32755}, sin_zero = "\200F\355\202\363\177\000"}, sin6 = {sin6_family = 36880, sin6_port = 36082, 
              sin6_flowinfo = 32755, sin6_addr = {__in6_u = {__u6_addr8 = "\200F\355\202\363\177\000\000P\356r_\374\177\000", __u6_addr16 = {18048, 33517, 32755, 0, 
                    61008, 24434, 32764, 0}, __u6_addr32 = {2196588160, 32755, 1601367632, 32764}}}, sin6_scope_id = 4292624}}, id = 0, proto = -112 '\220', 
          send_flags = {f = 24435, blst_imask = 32764}}
        tmp = 0x7ff38b0d92e9 <xlog_helper+2924> "H\213\005Ȍ "
        new_uri = 0x0
        end = 0x418010 <_start> "1\355I\211\321^H\211\342H\203\344\360PTI\307\300p\212t"
        crt = 0x7ffc5f72efc0 "\360\357r_\374\177"
        cmd = 0x7ff38cfa3d30
        len = 32755
        user = -1929410856
        uri = {user = {s = 0x7ffc00000038 <Address 0x7ffc00000038 out of bounds>, len = 6889227}, passwd = {s = 0x100000000 <Address 0x100000000 out of bounds>, 
            len = 0}, host = {s = 0x7ff38cfe38b8 "\001", len = 1601367488}, port = {s = 0x7ff38cff72e8 "", len = 6800784}, params = {s = 0x7ffc5f72ec40 "", 
            len = -1930260464}, sip_params = {s = 0xaa6ec0 <_faked_sip_buf> "", len = -1930260464}, headers = {s = 0x7ffc5f72ec80 "\260\354r_\374\177", 
            len = -1985734390}, port_no = 0, proto = 0, type = ERROR_URI_T, flags = (unknown: 0), transport = {s = 0x800000 <yy_ec+512> "\001", len = 7547600}, ttl = {
            s = 0x6ed18 <Address 0x6ed18 out of bounds>, len = 841008}, user_param = {s = 0xcf6f8 <Address 0xcf6f8 out of bounds>, len = 8}, maddr = {
            s = 0x52 <Address 0x52 out of bounds>, len = 21281448}, method = {s = 0x7ffc5f72ecb0 "\320\355r_\374\177", len = 5653152}, lr = {s = 0x0, 
            len = -1930236096}, r2 = {s = 0xd900000000 <Address 0xd900000000 out of bounds>, len = -1929759304}, gr = {s = 0x7ffc5f72edd0 "P\356r_\374\177", 
            len = 6774445}, transport_val = {s = 0x0, len = 0}, ttl_val = {s = 0x0, len = 0}, user_param_val = {
            s = 0x418010 <_start> "1\355I\211\321^H\211\342H\203\344\360PTI\307\300p\212t", len = 21281280}, maddr_val = {s = 0x7ff38cff82b8 "", len = -1929714890}, 
          method_val = {s = 0x0, len = 0}, lr_val = {s = 0x0, len = -1920943803}, r2_val = {s = 0x7c0660 "core", len = 0}, gr_val = {
            s = 0x7c8c50 <__FUNCTION__.7400> "rval_destroy", len = 8128241}}
        next_hop = {user = {s = 0x7ffc5f72ec20 "\200\354r_\374\177", len = 6}, passwd = {s = 0x11 <Address 0x11 out of bounds>, len = -1920993373}, host = {s = 0x0, 
            len = 0}, port = {s = 0x100000002 <Address 0x100000002 out of bounds>, len = 21298736}, params = {s = 0x7ff38cf8ad48 "\037Qt\213\363\177", 
            len = -1929757408}, sip_params = {s = 0x0, len = 1048576}, headers = {s = 0x0, len = 0}, port_no = 0, proto = 0, type = ERROR_URI_T, 
          flags = (unknown: 56), transport = {s = 0x0, len = 56}, ttl = {s = 0xffffffff <Address 0xffffffff out of bounds>, len = 1}, user_param = {s = 0x0, 
            len = -1920970041}, maddr = {s = 0x1 <Address 0x1 out of bounds>, len = -1}, method = {s = 0x7ffc5f72ec20 "\200\354r_\374\177", len = 1601367024}, lr = {
            s = 0x0, len = 1601366976}, r2 = {s = 0x7ffc5f72ec30 "", len = 4469607}, gr = {s = 0x7daf70 "core", len = 1601366992}, transport_val = {
            s = 0x1 <Address 0x1 out of bounds>, len = 21281280}, ttl_val = {s = 0x100000038 <Address 0x100000038 out of bounds>, len = 21281008}, user_param_val = {
            s = 0x7ff38cff82b8 "", len = 0}, maddr_val = {s = 0x38 <Address 0x38 out of bounds>, len = 1}, method_val = {
            s = 0x7ff38cfae336 "sip:orig@scscf.ims.mnc001.mcc001.3gppnetwork.org:6060;lr", len = 1601367008}, lr_val = {s = 0x0, len = 1}, r2_val = {
            s = 0x7ffc00000000 <Address 0x7ffc00000000 out of bounds>, len = 4467850}, gr_val = {s = 0x38 <Address 0x38 out of bounds>, len = -1938363550}}
        u = 0x7ff38cff7610
        port = 0
        dst_host = 0x0
        i = 5
        flags = 0
        avp = 0x7ffc5f72efb0
        st = {flags = 1601354192, id = 32764, name = {n = 0, s = {s = 0x7ffc00000000 <Address 0x7ffc00000000 out of bounds>, len = 1601354160}, re = 0x7ffc00000000}, 
          avp = 0x7ffc5f72b9a8}
        sct = 0x418010 <_start>
        sjt = 0x7ff382ed4680
        rve = 0x7ff38cfa3d28
        mct = 0x7ff38cfa3d28
        rv = 0x7ffc5f72c9d0
        rv1 = 0x0
        c1 = {cache_type = 4292624, val_type = RV_NONE, c = {avp_val = {n = -1921732301, s = {
                s = 0x7ff38d74b133 <build_trtable+40> "H\211\342H\201", <incomplete sequence \352>, len = -1929715736}, re = 0x7ff38d74b133 <build_trtable+40>}, 
            pval = {rs = {s = 0x7ff38d74b133 <build_trtable+40> "H\211\342H\201", <incomplete sequence \352>, len = -1929715736}, ri = 21318304, flags = 0}}, 
          i2s = " \352r_\374\177\000\000\000\272D\001\000\000\000\000\000\000\000\000\000"}
        s = {s = 0x7ffc5f72e9f0 " \352r_\374\177", len = 6540334}
        srevp = {0x0, 0x0}
        evp = {data = 0x0, rcv = 0x0, dst = 0x0}
        mod_f_params = {{type = NOSUBTYPE, u = {number = 0, string = 0x0, str = {s = 0x0, len = 0}, data = 0x0, attr = 0x0, select = 0x0}}, {type = NOSUBTYPE, u = {
              number = 0, string = 0x0, str = {s = 0x0, len = 0}, data = 0x0, attr = 0x0, select = 0x0}}, {type = NOSUBTYPE, u = {number = 0, string = 0x0, str = {
                s = 0x0, len = 0}, data = 0x0, attr = 0x0, select = 0x0}}, {type = NOSUBTYPE, u = {number = 0, string = 0x0, str = {s = 0x0, len = 0}, data = 0x0, 
              attr = 0x0, select = 0x0}}, {type = NOSUBTYPE, u = {number = 0, string = 0x0, str = {s = 0x0, len = 0}, data = 0x0, attr = 0x0, select = 0x0}}, {
            type = NOSUBTYPE, u = {number = 0, string = 0x0, str = {s = 0x0, len = 0}, data = 0x0, attr = 0x0, select = 0x0}}, {type = NOSUBTYPE, u = {number = 0, 
              string = 0x0, str = {s = 0x0, len = 0}, data = 0x0, attr = 0x0, select = 0x0}}, {type = NOSUBTYPE, u = {number = 0, string = 0x0, str = {s = 0x0, 
                len = 0}, data = 0x0, attr = 0x0, select = 0x0}}}
        __FUNCTION__ = "do_action"
#13 0x0000000000442c8a in run_actions (h=0x7ffc5f72f760, a=0x7ff38cfa4db8, msg=0x7ff38cff86d8) at core/action.c:1565
        t = 0x7ff38cfa4db8
        ret = -1
        mod = 0x0
        ms = 0
        __FUNCTION__ = "run_actions"
#14 0x0000000000436494 in do_action (h=0x7ffc5f72f760, a=0x7ff38cfa4f08, msg=0x7ff38cff86d8) at core/action.c:1062
        ret = 1
        v = 0
        dst = {send_sock = 0x400418010, to = {s = {sa_family = 29932, sa_data = "\244\000\000\000\000\000\354t\244\000\000\000\000"}, sin = {sin_family = 29932, 
              sin_port = 164, sin_addr = {s_addr = 0}, sin_zero = "\354t\244\000\000\000\000"}, sin6 = {sin6_family = 29932, sin6_port = 164, sin6_flowinfo = 0, 
              sin6_addr = {__in6_u = {__u6_addr8 = "\354t\244\000\000\000\000\000\220\305g\000\000\000\000", __u6_addr16 = {29932, 164, 0, 0, 50576, 103, 0, 0}, 
                  __u6_addr32 = {10777836, 0, 6800784, 0}}}, sin6_scope_id = 1601369264}}, id = 32764, proto = 16 '\020', send_flags = {f = 36082, blst_imask = 32755}}
        tmp = 0x7dd450 "core"
        new_uri = 0x6b <Address 0x6b out of bounds>
        end = 0xcf6f8 <Address 0xcf6f8 out of bounds>
        crt = 0x400418010 <Address 0x400418010 out of bounds>
        cmd = 0x7ff38cf7faa0
        len = 32755
        user = -2098379136
        uri = {user = {s = 0x7ff38cfdee10 "\001", len = -1929495816}, passwd = {s = 0x7ffc5f72f3f2 "\005\005", len = 1601369075}, host = {
            s = 0xa477aa <buf.6778+842> "", len = 10777815}, port = {s = 0x7e78c0 <__FUNCTION__.6618> "parse_via", len = 8277472}, params = {
            s = 0x40 <Address 0x40 out of bounds>, len = -1930260464}, sip_params = {s = 0x7ff38cff86d8 "\a", len = 1}, headers = {s = 0x7ffc5f72f410 "", 
            len = -1929495872}, port_no = 34520, proto = 36095, type = 83918835, flags = (unknown: 1601369068), transport = {
            s = 0x500000000 <Address 0x500000000 out of bounds>, len = 10777786}, ttl = {s = 0x400418010 <Address 0x400418010 out of bounds>, len = 10777791}, 
          user_param = {
            s = 0xa474bf <buf.6778+95> ";branch=z9hG4bK22155406;rport\r\nFrom: <sip:alice@ims.mnc001.mcc001.3gppnetwork.org>;tag=22179732\r\nTo: <sip:alice@ims.mnc001.mcc001.3gppnetwork.org>\r\nContact: <sip:alice@127.0.0.1:55181;transport=udp>;+"..., len = 5}, maddr = {s = 0x7ffc5f72f530 "\020\214\375\214\363\177", len = 7087670}, 
          method = {s = 0xffffffff00000001 <Address 0xffffffff00000001 out of bounds>, len = -1930260464}, lr = {s = 0x7ffc5f72f400 "0\364r_\374\177", 
            len = -1985734390}, r2 = {s = 0x25f72f3f0 <Address 0x25f72f3f0 out of bounds>, len = 0}, gr = {s = 0x800000 <yy_ec+512> "\001", len = -1929515504}, 
          transport_val = {s = 0xa477aa <buf.6778+842> "", len = 10777764}, ttl_val = {s = 0xcf6f8 <Address 0xcf6f8 out of bounds>, len = 8}, user_param_val = {
            s = 0x505006a <Address 0x505006a out of bounds>, len = -1929515560}, maddr_val = {s = 0x7ffc5f72f430 "\370:\376\214\363\177", len = 5653152}, 
          method_val = {s = 0x0, len = 8189296}, lr_val = {s = 0x0, len = -2098379136}, r2_val = {s = 0x7ff38cfe3af8 <incomplete sequence \353>, len = 6767209}, 
          gr_val = {s = 0x7dd450 "core", len = -1933243772}}
        next_hop = {user = {s = 0xd <Address 0xd out of bounds>, len = 4706330}, passwd = {s = 0x7ffc5f72f190 "\260\362r_\374\177", len = 5653152}, host = {s = 0x0, 
            len = -1930228592}, port = {s = 0x11c00000000 <Address 0x11c00000000 out of bounds>, len = -1930228592}, params = {s = 0x7ffc5f72f2b0 "@\364r_\374\177", 
            len = 6774445}, sip_params = {s = 0x7ffc5f72f290 "\340/~", len = 5628601}, headers = {s = 0x7ff300000001 <Address 0x7ff300000001 out of bounds>, 
            len = -1932625360}, port_no = 1, proto = 0, type = SIP_URI_T, flags = (unknown: 6800784), transport = {s = 0x7ffc5f72f210 "", len = -1930260464}, ttl = {
            s = 0x508cced91f <Address 0x508cced91f out of bounds>, len = -1930260464}, user_param = {s = 0x7ffc5f72f250 "\200\363r_\374\177", len = -1985734390}, 
          maddr = {s = 0x7ff38cce7a30 "tm", len = 0}, method = {s = 0x800000 <yy_ec+512> "\001", len = 7550128}, lr = {s = 0x6e338 <Address 0x6e338 out of bounds>, 
            len = 838480}, r2 = {s = 0x4000cf6f8 <Address 0x4000cf6f8 out of bounds>, len = 8269792}, gr = {s = 0x68 <Address 0x68 out of bounds>, len = -1929495872}, 
          transport_val = {s = 0x7ffc5f72f380 "0\365r_\374\177", len = 7041108}, ttl_val = {s = 0x0, len = 8189296}, user_param_val = {s = 0x0, len = -2098379136}, 
          maddr_val = {s = 0x7ffc5f72f380 "0\365r_\374\177", len = 6767209}, method_val = {s = 0x7e2fe0 "core", len = 1601372816}, lr_val = {s = 0x0, len = 0}, 
          r2_val = {s = 0x7ffc5f72f440 "P\324}", len = -1933257484}, gr_val = {s = 0x7ff38cce7a30 "tm", len = 10777802}}
        u = 0x7ffc5f72f650
        port = 0
        dst_host = 0xa477aa <buf.6778+842>
        i = 2
        flags = 0
        avp = 0xa475e1 <buf.6778+385>
        st = {flags = 8388608, id = 0, name = {n = 7542640, s = {
              s = 0x731770 <ip6tosbuf+781> "E0\210\002\213E\334H\230H\215P\002H\213E\300H\001\302A\200\374\tv\aA\215D$7\353\005A\215D$0\210\002\213E\334H\230H\215P\003H\213E\300H\001\302\200\373\tv\005\215C7\353\003\215C0\210\002\203E\334\004\351", <incomplete sequence \330>, len = 458872}, re = 0x731770 <ip6tosbuf+781>}, 
          avp = 0xce890}
        sct = 0x6e680
        sjt = 0x733168 <add_alias+197>
        rve = 0x7ff38cfa4450
        mct = 0x800000 <yy_ec+512>
        rv = 0x0
        rv1 = 0xa475ea <buf.6778+394>
        c1 = {cache_type = 1601368352, val_type = 32764, c = {avp_val = {n = -1930260464, s = {s = 0x7ff38cf29010 "\001", len = -2100816512}, re = 0x7ff38cf29010}, 
            pval = {rs = {s = 0x7ff38cf29010 "\001", len = -2100816512}, ri = -1930260464, flags = 32755}}, 
          i2s = "`\361r_\374\177\000\000\n\031\244\211\363\177\000\000\333\005}\000\000"}
        s = {s = 0x7ff382c49000 "", len = 6800784}
        srevp = {0x6722a9 <qm_insert_free+59>, 0x7ff382ee9110}
        evp = {data = 0x0, rcv = 0x0, dst = 0x0}
        mod_f_params = {{type = NOSUBTYPE, u = {number = 0, string = 0x0, str = {s = 0x0, len = 0}, data = 0x0, attr = 0x0, select = 0x0}}, {type = NOSUBTYPE, u = {
              number = 0, string = 0x0, str = {s = 0x0, len = 0}, data = 0x0, attr = 0x0, select = 0x0}}, {type = NOSUBTYPE, u = {number = 0, string = 0x0, str = {
                s = 0x0, len = 0}, data = 0x0, attr = 0x0, select = 0x0}}, {type = NOSUBTYPE, u = {number = 0, string = 0x0, str = {s = 0x0, len = 0}, data = 0x0, 
              attr = 0x0, select = 0x0}}, {type = NOSUBTYPE, u = {number = 0, string = 0x0, str = {s = 0x0, len = 0}, data = 0x0, attr = 0x0, select = 0x0}}, {
            type = NOSUBTYPE, u = {number = 0, string = 0x0, str = {s = 0x0, len = 0}, data = 0x0, attr = 0x0, select = 0x0}}, {type = NOSUBTYPE, u = {number = 0, 
              string = 0x0, str = {s = 0x0, len = 0}, data = 0x0, attr = 0x0, select = 0x0}}, {type = NOSUBTYPE, u = {number = 0, string = 0x0, str = {s = 0x0, 
                len = 0}, data = 0x0, attr = 0x0, select = 0x0}}}
        __FUNCTION__ = "do_action"
#15 0x0000000000442c8a in run_actions (h=0x7ffc5f72f760, a=0x7ff38cf92b38, msg=0x7ff38cff86d8) at core/action.c:1565
        t = 0x7ff38cfa4f08
        ret = 1
        mod = 0x733658 <yyparse+301>
        ms = 0
        __FUNCTION__ = "run_actions"
#16 0x000000000044342f in run_top_route (a=0x7ff38cf92b38, msg=0x7ff38cff86d8, c=0x0) at core/action.c:1654
        ctx = {rec_lev = 3, run_flags = 0, last_retcode = 1, jmp_env = {{__jmpbuf = {140683850368640, -3424828826357032147, 4292624, 140721909858960, 0, 0, 
                -3424828826319283411, 3422786561839504173}, __mask_was_saved = 0, __saved_mask = {__val = {0, 4611686022722355200, 140684019336920, 140721909856336, 
                  5184730, 1776, 140684018487312, 10778092, 10777759, 6660419592, 140684019336920, 1073741825, 0, 4292624, 140683850368640, 4292624}}}}}
        p = 0x7ffc5f72f760
        ret = 0
        sfbk = 0
#17 0x000000000056c231 in receive_msg (
    buf=0xa47460 <buf.6778> "SUBSCRIBE sip:alice@ims.mnc001.mcc001.3gppnetwork.org SIP/2.0\r\nVia: SIP/2.0/UDP 127.0.0.1:55181;branch=z9hG4bK22155406;rport\r\nFrom: <sip:alice@ims.mnc001.mcc001.3gppnetwork.org>;tag=22179732\r\nTo: <sip"..., len=842, rcv_info=0x7ffc5f72fd70) at core/receive.c:277
        msg = 0x7ff38cff86d8
        ctx = {rec_lev = 0, run_flags = 0, last_retcode = 0, jmp_env = {{__jmpbuf = {0, 0, 0, 0, 0, 0, 0, 0}, __mask_was_saved = 0, __saved_mask = {__val = {
                  0 <repeats 15 times>, 1}}}}}
        bctx = 0x460e47 <su2ip_addr+100>
        ret = 0
        stats_on = 0
        tvb = {tv_sec = 0, tv_usec = 0}
        tve = {tv_sec = 0, tv_usec = 0}
        tz = {tz_minuteswest = 0, tz_dsttime = 0}
        diff = 0
        inb = {
          s = 0xa47460 <buf.6778> "SUBSCRIBE sip:alice@ims.mnc001.mcc001.3gppnetwork.org SIP/2.0\r\nVia: SIP/2.0/UDP 127.0.0.1:55181;branch=z9hG4bK22155406;rport\r\nFrom: <sip:alice@ims.mnc001.mcc001.3gppnetwork.org>;tag=22179732\r\nTo: <sip"..., len = 842}
        netinfo = {data = {s = 0x2 <Address 0x2 out of bounds>, len = 0}, rcv = 0x0, dst = 0x0}
        keng = 0x0
        evp = {data = 0x7ffc5f72f920, rcv = 0x7ffc5f72fd70, dst = 0x0}
        __FUNCTION__ = "receive_msg"
#18 0x0000000000468ce3 in udp_rcv_loop () at core/udp_server.c:554
        len = 842
        buf = "SUBSCRIBE sip:alice@ims.mnc001.mcc001.3gppnetwork.org SIP/2.0\r\nVia: SIP/2.0/UDP 127.0.0.1:55181;branch=z9hG4bK22155406;rport\r\nFrom: <sip:alice@ims.mnc001.mcc001.3gppnetwork.org>;tag=22179732\r\nTo: <sip"...
        tmp = 0x0
        from = 0x7ff38cfd68a8
        fromlen = 16
        ri = {src_ip = {af = 2, len = 4, u = {addrl = {33751050, 0}, addr32 = {33751050, 0, 0, 0}, addr16 = {10, 515, 0, 0, 0, 0, 0, 0}, 
              addr = "\n\000\003\002", '\000' <repeats 11 times>}}, dst_ip = {af = 2, len = 4, u = {addrl = {1698212032, 0}, addr32 = {1698212032, 0, 0, 0}, addr16 = {
                43200, 25912, 0, 0, 0, 0, 0, 0}, addr = "\300\250\070e", '\000' <repeats 11 times>}}, src_port = 55181, dst_port = 4060, proto_reserved1 = 0, 
          proto_reserved2 = 0, src_su = {s = {sa_family = 2, sa_data = "\327\215\n\000\003\002\000\000\000\000\000\000\000"}, sin = {sin_family = 2, sin_port = 36311, 
              sin_addr = {s_addr = 33751050}, sin_zero = "\000\000\000\000\000\000\000"}, sin6 = {sin6_family = 2, sin6_port = 36311, sin6_flowinfo = 33751050, 
              sin6_addr = {__in6_u = {__u6_addr8 = '\000' <repeats 15 times>, __u6_addr16 = {0, 0, 0, 0, 0, 0, 0, 0}, __u6_addr32 = {0, 0, 0, 0}}}, 
              sin6_scope_id = 0}}, bind_address = 0x7ff38cf7bcf8, proto = 1 '\001'}
        evp = {data = 0x0, rcv = 0x0, dst = 0x0}
        printbuf = '\000' <repeats 12 times>, "\001\000\000\000\232\323\354\206\363\177\000\000\017", '\000' <repeats 59 times>, "\001\000\000\000\210\347\370\214\363\177\000\000\377", '\000' <repeats 15 times>, "in.c:139\200F\355\202\363\177\000\000\020\200A\000\000\000\000\000\220\002s_\374\177", '\000' <repeats 18 times>, "\260\374r_\374\177\000\000\346\234P\000\000\000\000\000\177", '\000' <repeats 15 times>, "\214F\355\202\363\177\000\000"...
        i = 32764
        j = 1601372816
        l = 0
        __FUNCTION__ = "udp_rcv_loop"
#19 0x000000000042224c in main_loop () at main.c:1430
        i = 0
        pid = 15912
        si = 0x200418010
        si_desc = "\340\376r_\001\000\000\000ء\375\214\363\177\000\000\340\376r_\374\177\000\000\246\023g\000\000\000\000\000\020\200A\000\000\000\000\000\310&Ȃ\363\177", '\000' <repeats 14 times>, "\001\000\000\000\060\377r_\374\177\000\000\345\345g\000\000\000\000\000 \001x\000\000\000\000\000\330\017\376\214\363\177\000\000i\024x\000\000\000\000\000\211\002x\000\000\000\000\000\004\000\000\000\000\000\000\000\000\220Ă\363\177\000"
        nrprocs = 722909423
        woneinit = 0
        __FUNCTION__ = "main_loop"
#20 0x000000000042a49e in main (argc=3, argv=0x7ffc5f730298) at main.c:2645
        cfg_stream = 0x13c7010
        c = -1
        r = 0
        tmp = 0x7ff38e137a68 "\230y\023\216\363\177"
        tmp_len = 0
        port = 0
        proto = 0
        options = 0x74bee0 ":f:cm:M:dVIhEeb:l:L:n:vKrRDTN:W:w:t:u:g:P:G:SQ:O:a:A:x:X:Y:"
        ret = -1
        seed = 1732195628
        rfd = 4
        debug_save = 0
        debug_flag = 0
        dont_fork_cnt = 0
        n_lst = 0x0
        p = 0x0
        st = {st_dev = 19, st_ino = 47716, st_nlink = 2, st_mode = 16832, st_uid = 0, st_gid = 0, __pad0 = 0, st_rdev = 0, st_size = 100, st_blksize = 4096, 
          st_blocks = 0, st_atim = {tv_sec = 1528349250, tv_nsec = 282639597}, st_mtim = {tv_sec = 1528367174, tv_nsec = 104307643}, st_ctim = {tv_sec = 1528367174, 
            tv_nsec = 104307643}, __unused = {0, 0, 0}}
        __FUNCTION__ = "main"

```

#### Log Messages

```
[root@osboxes kamailio_pcscf]# kamailio -f /usr/local/etc/kamailio_pcscf/kamailio-pcscf.cfg
loading modules under config path: /usr/local/lib64/kamailio/modules/
 0(16002) INFO: <core> [core/sctp_core.c:75]: sctp_core_check_support(): SCTP API not enabled - if you want to use it, load sctp module
Listening on
             udp: 192.168.56.101 [192.168.56.101]:4060
Aliases:
             *: pcscf.ims.mnc001.mcc001.3gppnetwork.org:*

WARNING: no fork mode
 0(16002) INFO: rr [../outbound/api.h:52]: ob_load_api(): unable to import bind_ob - maybe module is not loaded
 0(16002) INFO: rr [rr_mod.c:175]: mod_init(): outbound module not available
 0(16002) INFO: ims_usrloc_pcscf [hslot.c:62]: ul_init_locks(): locks array size 1024
 0(16002) INFO: <core> [core/udp_server.c:153]: probe_max_receive_buffer(): SO_RCVBUF is initially 212992
 0(16002) INFO: <core> [core/udp_server.c:205]: probe_max_receive_buffer(): SO_RCVBUF is finally 425984
 0(16002) INFO: <script>:  [REGISTER] from [sip:alice@ims.mnc001.mcc001.3gppnetwork.org] to [sip:alice@ims.mnc001.mcc001.3gppnetwork.org]
 0(16002) ERROR: <script>: REGISTER (sip:alice@ims.mnc001.mcc001.3gppnetwork.org (10.0.3.2:49178) to sip:alice@ims.mnc001.mcc001.3gppnetwork.org, d0cb661a-aefd-53b6-dc11-aee832fd7123)
 0(16002) ERROR: ims_registrar_pcscf [save.c:342]: save_pending(): Error parsing sec-agree parameters: 4
 0(16002) INFO: <script>:  [REGISTER] from [sip:alice@ims.mnc001.mcc001.3gppnetwork.org] to [sip:alice@ims.mnc001.mcc001.3gppnetwork.org]
 0(16002) ERROR: <script>: REGISTER (sip:alice@ims.mnc001.mcc001.3gppnetwork.org (10.0.3.2:49178) to sip:alice@ims.mnc001.mcc001.3gppnetwork.org, d0cb661a-aefd-53b6-dc11-aee832fd7123)
 0(16002) ERROR: ims_registrar_pcscf [save.c:342]: save_pending(): Error parsing sec-agree parameters: 4
 0(16002) INFO: <script>:  [SUBSCRIBE] from [sip:alice@ims.mnc001.mcc001.3gppnetwork.org] to [sip:alice@ims.mnc001.mcc001.3gppnetwork.org]
 0(16002) ERROR: <script>: SUBSCRIBE (sip:alice@ims.mnc001.mcc001.3gppnetwork.org (10.0.3.2:49178) to sip:alice@ims.mnc001.mcc001.3gppnetwork.org, 988b1427-88f8-406d-1454-aeff7304dddb)
Segmentation fault (core dumped)

```

#### SIP Traffic

```
[root@osboxes ~]# tcpdump -i any port 4060 -A -s 0 -nn
tcpdump: verbose output suppressed, use -v or -vv for full protocol decode
listening on any, link-type LINUX_SLL (Linux cooked), capture size 262144 bytes

06:34:21.504451 IP 10.0.3.2.49178 > 192.168.56.101.4060: UDP, length 868
E.......@...
.....8e.....l
.REGISTER sip:ims.mnc001.mcc001.3gppnetwork.org SIP/2.0
Via: SIP/2.0/UDP 127.0.0.1:49178;branch=z9hG4bK22613780;rport
From: <sip:alice@ims.mnc001.mcc001.3gppnetwork.org>;tag=22642025
To: <sip:alice@ims.mnc001.mcc001.3gppnetwork.org>
Contact: <sip:alice@127.0.0.1:49178;transport=udp>;expires=600000;+g.oma.sip-im;language="en,fr";+g.3gpp.smsip;+g.oma.sip-im.large-message;audio;+g.3gpp.icsi-ref="urn%3Aurn-7%3A3gpp-application.ims.iari.gsma-vs";+g.3gpp.cs-voice
Call-ID: d0cb661a-aefd-53b6-dc11-aee832fd7123
CSeq: 10207 REGISTER
Content-Length: 0
Max-Forwards: 70
Allow: INVITE, ACK, CANCEL, BYE, MESSAGE, OPTIONS, NOTIFY, PRACK, UPDATE, REFER
Privacy: none
P-Access-Network-Info: ADSL;utran-cell-id-3gpp=00000000
User-Agent: IM-client/OMA1.0 Boghe-Win32/v2.0.153.836
P-Preferred-Identity: <sip:alice@ims.mnc001.mcc001.3gppnetwork.org>
Supported: path

................
06:34:21.505544 IP 192.168.56.101.4060 > 10.0.3.2.49178: UDP, length 549
E..A....@.l...8e
........-.NSIP/2.0 100 Trying
Via: SIP/2.0/UDP 127.0.0.1:49178;branch=z9hG4bK22613780;rport=49178;received=10.0.3.2
From: <sip:alice@ims.mnc001.mcc001.3gppnetwork.org>;tag=22642025
To: <sip:alice@ims.mnc001.mcc001.3gppnetwork.org>
Call-ID: d0cb661a-aefd-53b6-dc11-aee832fd7123
CSeq: 10207 REGISTER
Server: Kamailio P-CSCF
Content-Length: 0
Warning: 392 192.168.56.101:4060 "Noisy feedback tells:  pid=16002 req_src_ip=10.0.3.2 req_src_port=49178 in_uri=sip:ims.mnc001.mcc001.3gppnetwork.org out_uri=sip:ims.mnc001.mcc001.3gppnetwork.org via_cnt==1"

................
06:34:21.507267 IP 192.168.56.101.4060 > 192.168.56.101.5060: SIP: REGISTER sip:ims.mnc001.mcc001.3gppnetwork.org SIP/2.0
E...7f..@.L...8e..8e.....{..REGISTER sip:ims.mnc001.mcc001.3gppnetwork.org SIP/2.0
Via: SIP/2.0/UDP 192.168.56.101:4060;branch=z9hG4bK9a2b.e288671bc5d681b0a2965b18b9e50542.0
Via: SIP/2.0/UDP 127.0.0.1:49178;received=10.0.3.2;branch=z9hG4bK22613780;rport=49178
From: <sip:alice@ims.mnc001.mcc001.3gppnetwork.org>;tag=22642025
To: <sip:alice@ims.mnc001.mcc001.3gppnetwork.org>
Contact: <sip:alice@127.0.0.1:49178;transport=udp>;expires=600000;+g.oma.sip-im;language="en,fr";+g.3gpp.smsip;+g.oma.sip-im.large-message;audio;+g.3gpp.icsi-ref="urn%3Aurn-7%3A3gpp-application.ims.iari.gsma-vs";+g.3gpp.cs-voice
Call-ID: d0cb661a-aefd-53b6-dc11-aee832fd7123
CSeq: 10207 REGISTER
Content-Length: 0
Max-Forwards: 69
Allow: INVITE, ACK, CANCEL, BYE, MESSAGE, OPTIONS, NOTIFY, PRACK, UPDATE, REFER
Privacy: none
P-Access-Network-Info: ADSL;utran-cell-id-3gpp=00000000
User-Agent: IM-client/OMA1.0 Boghe-Win32/v2.0.153.836
P-Preferred-Identity: <sip:alice@ims.mnc001.mcc001.3gppnetwork.org>
Supported: path
Path: <sip:term@pcscf.ims.mnc001.mcc001.3gppnetwork.org:4060;lr>
Supported: path
Require: path
P-Visited-Network-ID: ims.mnc001.mcc001.3gppnetwork.org

................
06:34:21.507486 IP 192.168.56.101.5060 > 192.168.56.101.4060: SIP: SIP/2.0 100 Trying
E...7g..@.N...8e..8e........SIP/2.0 100 Trying
Via: SIP/2.0/UDP 192.168.56.101:4060;branch=z9hG4bK9a2b.e288671bc5d681b0a2965b18b9e50542.0
Via: SIP/2.0/UDP 127.0.0.1:49178;received=10.0.3.2;branch=z9hG4bK22613780;rport=49178
From: <sip:alice@ims.mnc001.mcc001.3gppnetwork.org>;tag=22642025
To: <sip:alice@ims.mnc001.mcc001.3gppnetwork.org>
Call-ID: d0cb661a-aefd-53b6-dc11-aee832fd7123
CSeq: 10207 REGISTER
Server: Kamailio I-CSCF
Content-Length: 0
Warning: 392 192.168.56.101:5060 "Noisy feedback tells:  pid=15608 req_src_ip=192.168.56.101 req_src_port=4060 in_uri=sip:ims.mnc001.mcc001.3gppnetwork.org out_uri=sip:ims.mnc001.mcc001.3gppnetwork.org via_cnt==2"

................
06:34:21.551488 IP 192.168.56.101.5060 > 192.168.56.101.4060: SIP: SIP/2.0 401 Unauthorized - Challenging the UE
E...7n..@.Np..8e..8e........SIP/2.0 401 Unauthorized - Challenging the UE
Via: SIP/2.0/UDP 192.168.56.101:4060;branch=z9hG4bK9a2b.e288671bc5d681b0a2965b18b9e50542.0
Via: SIP/2.0/UDP 127.0.0.1:49178;received=10.0.3.2;branch=z9hG4bK22613780;rport=49178
From: <sip:alice@ims.mnc001.mcc001.3gppnetwork.org>;tag=22642025
To: <sip:alice@ims.mnc001.mcc001.3gppnetwork.org>;tag=4be9d07af59780377285d1aba6f964e3-8e87
Call-ID: d0cb661a-aefd-53b6-dc11-aee832fd7123
CSeq: 10207 REGISTER
WWW-Authenticate: Digest realm="ims.mnc001.mcc001.3gppnetwork.org", nonce="ddae560be0664e9b2cc83c74f84bdc15", algorithm=MD5, qop="auth,auth-int"
Path: <sip:term@pcscf.ims.mnc001.mcc001.3gppnetwork.org:4060;lr>
Server: Kamailio S-CSCF
Content-Length: 0

................
06:34:21.552560 IP 192.168.56.101.4060 > 10.0.3.2.49178: UDP, length 620
E.......@.l...8e
........t..SIP/2.0 401 Unauthorized - Challenging the UE
Via: SIP/2.0/UDP 127.0.0.1:49178;received=10.0.3.2;branch=z9hG4bK22613780;rport=49178
From: <sip:alice@ims.mnc001.mcc001.3gppnetwork.org>;tag=22642025
To: <sip:alice@ims.mnc001.mcc001.3gppnetwork.org>;tag=4be9d07af59780377285d1aba6f964e3-8e87
Call-ID: d0cb661a-aefd-53b6-dc11-aee832fd7123
CSeq: 10207 REGISTER
WWW-Authenticate: Digest realm="ims.mnc001.mcc001.3gppnetwork.org", nonce="ddae560be0664e9b2cc83c74f84bdc15", algorithm=MD5, qop="auth,auth-int"
Path: <sip:term@pcscf.ims.mnc001.mcc001.3gppnetwork.org:4060;lr>
Server: Kamailio S-CSCF
Content-Length: 0

................
06:34:21.557217 IP 10.0.3.2.49178 > 192.168.56.101.4060: UDP, length 1194
E.......@...
.....8e......5.REGISTER sip:ims.mnc001.mcc001.3gppnetwork.org SIP/2.0
Via: SIP/2.0/UDP 127.0.0.1:49178;branch=z9hG4bK22636944;rport
From: <sip:alice@ims.mnc001.mcc001.3gppnetwork.org>;tag=22642025
To: <sip:alice@ims.mnc001.mcc001.3gppnetwork.org>
Contact: <sip:alice@127.0.0.1:49178;transport=udp>;expires=600000;+g.oma.sip-im;language="en,fr";+g.3gpp.smsip;+g.oma.sip-im.large-message;audio;+g.3gpp.icsi-ref="urn%3Aurn-7%3A3gpp-application.ims.iari.gsma-vs";+g.3gpp.cs-voice
Call-ID: d0cb661a-aefd-53b6-dc11-aee832fd7123
CSeq: 10208 REGISTER
Content-Length: 0
Max-Forwards: 70
Authorization: Digest username="alice@ims.mnc001.mcc001.3gppnetwork.org",realm="ims.mnc001.mcc001.3gppnetwork.org",nonce="ddae560be0664e9b2cc83c74f84bdc15",uri="sip:ims.mnc001.mcc001.3gppnetwork.org",response="ef718272941cc1e294e1ddcf6023d712",algorithm=MD5,cnonce="5dd7d99b175120b4e1f76ae10320c721",qop=auth-int,nc=00000001
Allow: INVITE, ACK, CANCEL, BYE, MESSAGE, OPTIONS, NOTIFY, PRACK, UPDATE, REFER
Privacy: none
P-Access-Network-Info: ADSL;utran-cell-id-3gpp=00000000
User-Agent: IM-client/OMA1.0 Boghe-Win32/v2.0.153.836
P-Preferred-Identity: <sip:alice@ims.mnc001.mcc001.3gppnetwork.org>
Supported: path

................
06:34:21.557722 IP 192.168.56.101.4060 > 10.0.3.2.49178: UDP, length 549
E..A....@.l...8e
........-.NSIP/2.0 100 Trying
Via: SIP/2.0/UDP 127.0.0.1:49178;branch=z9hG4bK22636944;rport=49178;received=10.0.3.2
From: <sip:alice@ims.mnc001.mcc001.3gppnetwork.org>;tag=22642025
To: <sip:alice@ims.mnc001.mcc001.3gppnetwork.org>
Call-ID: d0cb661a-aefd-53b6-dc11-aee832fd7123
CSeq: 10208 REGISTER
Server: Kamailio P-CSCF
Content-Length: 0
Warning: 392 192.168.56.101:4060 "Noisy feedback tells:  pid=16002 req_src_ip=10.0.3.2 req_src_port=49178 in_uri=sip:ims.mnc001.mcc001.3gppnetwork.org out_uri=sip:ims.mnc001.mcc001.3gppnetwork.org via_cnt==1"

................
06:34:21.557999 IP 192.168.56.101.4060 > 192.168.56.101.5060: SIP: REGISTER sip:ims.mnc001.mcc001.3gppnetwork.org SIP/2.0
E...7r..@.K{..8e..8e........REGISTER sip:ims.mnc001.mcc001.3gppnetwork.org SIP/2.0
Via: SIP/2.0/UDP 192.168.56.101:4060;branch=z9hG4bK7b2b.a496c2fac4d8daef7f1ca3be76dace27.0
Via: SIP/2.0/UDP 127.0.0.1:49178;received=10.0.3.2;branch=z9hG4bK22636944;rport=49178
From: <sip:alice@ims.mnc001.mcc001.3gppnetwork.org>;tag=22642025
To: <sip:alice@ims.mnc001.mcc001.3gppnetwork.org>
Contact: <sip:alice@127.0.0.1:49178;transport=udp>;expires=600000;+g.oma.sip-im;language="en,fr";+g.3gpp.smsip;+g.oma.sip-im.large-message;audio;+g.3gpp.icsi-ref="urn%3Aurn-7%3A3gpp-application.ims.iari.gsma-vs";+g.3gpp.cs-voice
Call-ID: d0cb661a-aefd-53b6-dc11-aee832fd7123
CSeq: 10208 REGISTER
Content-Length: 0
Max-Forwards: 69
Authorization: Digest username="alice@ims.mnc001.mcc001.3gppnetwork.org",realm="ims.mnc001.mcc001.3gppnetwork.org",nonce="ddae560be0664e9b2cc83c74f84bdc15",uri="sip:ims.mnc001.mcc001.3gppnetwork.org",response="ef718272941cc1e294e1ddcf6023d712",algorithm=MD5,cnonce="5dd7d99b175120b4e1f76ae10320c721",qop=auth-int,nc=00000001
Allow: INVITE, ACK, CANCEL, BYE, MESSAGE, OPTIONS, NOTIFY, PRACK, UPDATE, REFER
Privacy: none
P-Access-Network-Info: ADSL;utran-cell-id-3gpp=00000000
User-Agent: IM-client/OMA1.0 Boghe-Win32/v2.0.153.836
P-Preferred-Identity: <sip:alice@ims.mnc001.mcc001.3gppnetwork.org>
Supported: path
Path: <sip:term@pcscf.ims.mnc001.mcc001.3gppnetwork.org:4060;lr>
Supported: path
Require: path
P-Visited-Network-ID: ims.mnc001.mcc001.3gppnetwork.org

................
06:34:21.558266 IP 192.168.56.101.5060 > 192.168.56.101.4060: SIP: SIP/2.0 100 Trying
E...7s..@.N...8e..8e........SIP/2.0 100 Trying
Via: SIP/2.0/UDP 192.168.56.101:4060;branch=z9hG4bK7b2b.a496c2fac4d8daef7f1ca3be76dace27.0
Via: SIP/2.0/UDP 127.0.0.1:49178;received=10.0.3.2;branch=z9hG4bK22636944;rport=49178
From: <sip:alice@ims.mnc001.mcc001.3gppnetwork.org>;tag=22642025
To: <sip:alice@ims.mnc001.mcc001.3gppnetwork.org>
Call-ID: d0cb661a-aefd-53b6-dc11-aee832fd7123
CSeq: 10208 REGISTER
Server: Kamailio I-CSCF
Content-Length: 0
Warning: 392 192.168.56.101:5060 "Noisy feedback tells:  pid=15608 req_src_ip=192.168.56.101 req_src_port=4060 in_uri=sip:ims.mnc001.mcc001.3gppnetwork.org out_uri=sip:ims.mnc001.mcc001.3gppnetwork.org via_cnt==2"

................
06:34:21.745656 IP 192.168.56.101.5060 > 192.168.56.101.4060: SIP: SIP/2.0 200 OK
E.
28...@.Fx..8e..8e....
..JSIP/2.0 200 OK
Via: SIP/2.0/UDP 192.168.56.101:4060;branch=z9hG4bK7b2b.a496c2fac4d8daef7f1ca3be76dace27.0
Via: SIP/2.0/UDP 127.0.0.1:49178;received=10.0.3.2;branch=z9hG4bK22636944;rport=49178
From: <sip:alice@ims.mnc001.mcc001.3gppnetwork.org>;tag=22642025
To: <sip:alice@ims.mnc001.mcc001.3gppnetwork.org>;tag=4be9d07af59780377285d1aba6f964e3-8e87
Call-ID: d0cb661a-aefd-53b6-dc11-aee832fd7123
CSeq: 10208 REGISTER
Contact: <sip:alice@127.0.0.1:63775;transport=udp>;q=0;expires=536925;language="en";+g.3gpp.smsip;+g.oma.sip-im.large-message;audio;+g.3gpp.icsi-ref="urn%3Aurn-7%3A3gpp-application.ims.iari.gsma-vs";+g.3gpp.cs-voice, <sip:alice@127.0.0.1:59735;transport=udp>;q=0;expires=537092;language="en";+g.3gpp.smsip;+g.oma.sip-im.large-message;audio;+g.3gpp.icsi-ref="urn%3Aurn-7%3A3gpp-application.ims.iari.gsma-vs";+g.3gpp.cs-voice, <sip:alice@127.0.0.1:51120;transport=udp>;q=0;expires=537528;language="en";+g.3gpp.smsip;+g.oma.sip-im.large-message;audio;+g.3gpp.icsi-ref="urn%3Aurn-7%3A3gpp-application.ims.iari.gsma-vs";+g.3gpp.cs-voice, <sip:alice@127.0.0.1:55888;transport=udp>;q=0;expires=537770;language="en";+g.3gpp.smsip;+g.oma.sip-im.large-message;audio;+g.3gpp.icsi-ref="urn%3Aurn-7%3A3gpp-application.ims.iari.gsma-vs";+g.3gpp.cs-voice, <sip:alice@127.0.0.1:52925;transport=udp>;q=0;expires=539181;language="en";+g.3gpp.smsip;+g.oma.sip-im.large-message;audio;+g.3gpp.icsi-ref="urn%3Aurn-7%3A3gpp-application.ims.iari.gsma-vs";+g.3gpp.cs-voice, <sip:alice@127.0.0.1:53770;transport=udp>;q=0;expires=539363;language="en";+g.3gpp.smsip;+g.oma.sip-im.large-message;audio;+g.3gpp.icsi-ref="urn%3Aurn-7%3A3gpp-application.ims.iari.gsma-vs";+g.3gpp.cs-voice, <sip:alice@127.0.0.1:60390;transport=udp>;q=0;expires=539511;language="en";+g.3gpp.smsip;+g.oma.sip-im.large-message;audio;+g.3gpp.icsi-ref="urn%3Aurn-7%3A3gpp-application.ims.iari.gsma-vs";+g.3gpp.cs-voice, <sip:alice@127.0.0.1:55181;transport=udp>;expires=539581;+g.3gpp.cs-voice;+g.3gpp.icsi-ref="urn%3Aurn-7%3A3gpp-application.ims.iari.gsma-vs";audio;+g.oma.sip-im.large-message;+g.3gpp.smsip;language="en,fr";+g.oma.sip-im, <sip:alice@127.0.0.1:49178;transport=udp>;expires=540000;+g.3gpp.cs-voice;+g.3gpp.icsi-ref="urn%3Aurn-7%3A3gpp-application.ims.iari.gsma-vs";audio;+g.oma.sip-im.large-message;+g.3gpp.smsip;language="en,fr";+g.oma.sip-im
Path: <sip:term@pcscf.ims.mnc001.mcc001.3gppnetwork.org:4060;lr>
P-Associated-URI: <sip:alice@ims.mnc001.mcc001.3gppnetwork.org>
Service-Route: <sip:orig@scscf.ims.mnc001.mcc001.3gppnetwork.org:6060;lr>
Server: Kamailio S-CSCF
Content-Length: 0

................
06:34:21.746512 IP 192.168.56.101.4060 > 10.0.3.2.49178: UDP, bad length 2490 > 1472
E..... .@.I...8e
....... ...SIP/2.0 200 OK
Via: SIP/2.0/UDP 127.0.0.1:49178;received=10.0.3.2;branch=z9hG4bK22636944;rport=49178
From: <sip:alice@ims.mnc001.mcc001.3gppnetwork.org>;tag=22642025
To: <sip:alice@ims.mnc001.mcc001.3gppnetwork.org>;tag=4be9d07af59780377285d1aba6f964e3-8e87
Call-ID: d0cb661a-aefd-53b6-dc11-aee832fd7123
CSeq: 10208 REGISTER
Contact: <sip:alice@127.0.0.1:63775;transport=udp>;q=0;expires=536925;language="en";+g.3gpp.smsip;+g.oma.sip-im.large-message;audio;+g.3gpp.icsi-ref="urn%3Aurn-7%3A3gpp-application.ims.iari.gsma-vs";+g.3gpp.cs-voice, <sip:alice@127.0.0.1:59735;transport=udp>;q=0;expires=537092;language="en";+g.3gpp.smsip;+g.oma.sip-im.large-message;audio;+g.3gpp.icsi-ref="urn%3Aurn-7%3A3gpp-application.ims.iari.gsma-vs";+g.3gpp.cs-voice, <sip:alice@127.0.0.1:51120;transport=udp>;q=0;expires=537528;language="en";+g.3gpp.smsip;+g.oma.sip-im.large-message;audio;+g.3gpp.icsi-ref="urn%3Aurn-7%3A3gpp-application.ims.iari.gsma-vs";+g.3gpp.cs-voice, <sip:alice@127.0.0.1:55888;transport=udp>;q=0;expires=537770;language="en";+g.3gpp.smsip;+g.oma.sip-im.large-message;audio;+g.3gpp.icsi-ref="urn%3Aurn-7%3A3gpp-application.ims.iari.gsma-vs";+g.3gpp.cs-voice, <sip:alice@127.0.0.1:52925;transport=udp>;q=0;expires=539181;language="en";+g.3gpp.smsip;+g.oma.sip-im.large-message;audio;+g.3gpp.icsi-ref="urn%3Aurn-7%3A3gpp-application.ims.iari.gsma-vs";+g.3gpp.cs-voice, <sip:alice@127.0.0.1:53770;transport=udp>;q=0;expires=539363;language="en";+g.3gpp.smsip;+g.................
06:34:21.752187 IP 10.0.3.2.49178 > 192.168.56.101.4060: UDP, length 842
E..f....@...
.....8e.....R..SUBSCRIBE sip:alice@ims.mnc001.mcc001.3gppnetwork.org SIP/2.0
Via: SIP/2.0/UDP 127.0.0.1:49178;branch=z9hG4bK22623420;rport
From: <sip:alice@ims.mnc001.mcc001.3gppnetwork.org>;tag=22629284
To: <sip:alice@ims.mnc001.mcc001.3gppnetwork.org>
Contact: <sip:alice@127.0.0.1:49178;transport=udp>;+g.oma.sip-im;language="en,fr"
Call-ID: 988b1427-88f8-406d-1454-aeff7304dddb
CSeq: 24466 SUBSCRIBE
Expires: 600000
Content-Length: 0
Max-Forwards: 70
Route: <sip:orig@scscf.ims.mnc001.mcc001.3gppnetwork.org:6060;lr>
Event: reg
Accept: application/reginfo+xml
Allow-Events: refer, presence, presence.winfo, xcap-diff, conference
Allow: INVITE, ACK, CANCEL, BYE, MESSAGE, OPTIONS, NOTIFY, PRACK, UPDATE, REFER
Privacy: none
P-Access-Network-Info: ADSL;utran-cell-id-3gpp=00000000
User-Agent: IM-client/OMA1.0 Boghe-Win32/v2.0.153.836

ser-Agent: IM-cl
06:34:21.758539 IP 10.0.3.2.49178 > 192.168.56.101.4060: UDP, length 865
E..}....@...
.....8e.....i..SUBSCRIBE sip:alice@ims.mnc001.mcc001.3gppnetwork.org SIP/2.0
Via: SIP/2.0/UDP 127.0.0.1:49178;branch=z9hG4bK22617074;rport
From: <sip:alice@ims.mnc001.mcc001.3gppnetwork.org>;tag=22624198
To: <sip:alice@ims.mnc001.mcc001.3gppnetwork.org>
Contact: <sip:alice@127.0.0.1:49178;transport=udp>;+g.oma.sip-im;language="en,fr"
Call-ID: 58052540-fcaa-cdad-9fde-76450602aa9d
CSeq: 32393 SUBSCRIBE
Expires: 600000
Content-Length: 0
Max-Forwards: 70
Route: <sip:orig@scscf.ims.mnc001.mcc001.3gppnetwork.org:6060;lr>
Event: message-summary
Accept: application/simple-message-summary
Allow-Events: refer, presence, presence.winfo, xcap-diff, conference
Allow: INVITE, ACK, CANCEL, BYE, MESSAGE, OPTIONS, NOTIFY, PRACK, UPDATE, REFER
Privacy: none
P-Access-Network-Info: ADSL;utran-cell-id-3gpp=00000000
User-Agent: IM-client/OMA1.0 Boghe-Win32/v2.0.153.836

................
06:34:22.253437 IP 10.0.3.2.49178 > 192.168.56.101.4060: UDP, length 842
E..f....@...
.....8e.....R..SUBSCRIBE sip:alice@ims.mnc001.mcc001.3gppnetwork.org SIP/2.0
Via: SIP/2.0/UDP 127.0.0.1:49178;branch=z9hG4bK22623420;rport
From: <sip:alice@ims.mnc001.mcc001.3gppnetwork.org>;tag=22629284
To: <sip:alice@ims.mnc001.mcc001.3gppnetwork.org>
Contact: <sip:alice@127.0.0.1:49178;transport=udp>;+g.oma.sip-im;language="en,fr"
Call-ID: 988b1427-88f8-406d-1454-aeff7304dddb
CSeq: 24466 SUBSCRIBE
Expires: 600000
Content-Length: 0
Max-Forwards: 70
Route: <sip:orig@scscf.ims.mnc001.mcc001.3gppnetwork.org:6060;lr>
Event: reg
Accept: application/reginfo+xml
Allow-Events: refer, presence, presence.winfo, xcap-diff, conference
Allow: INVITE, ACK, CANCEL, BYE, MESSAGE, OPTIONS, NOTIFY, PRACK, UPDATE, REFER
Privacy: none
P-Access-Network-Info: ADSL;utran-cell-id-3gpp=00000000
User-Agent: IM-client/OMA1.0 Boghe-Win32/v2.0.153.836

................
06:34:22.259972 IP 10.0.3.2.49178 > 192.168.56.101.4060: UDP, length 865
E..}....@...
.....8e.....i..SUBSCRIBE sip:alice@ims.mnc001.mcc001.3gppnetwork.org SIP/2.0
Via: SIP/2.0/UDP 127.0.0.1:49178;branch=z9hG4bK22617074;rport
From: <sip:alice@ims.mnc001.mcc001.3gppnetwork.org>;tag=22624198
To: <sip:alice@ims.mnc001.mcc001.3gppnetwork.org>
Contact: <sip:alice@127.0.0.1:49178;transport=udp>;+g.oma.sip-im;language="en,fr"
Call-ID: 58052540-fcaa-cdad-9fde-76450602aa9d
CSeq: 32393 SUBSCRIBE
Expires: 600000
Content-Length: 0
Max-Forwards: 70
Route: <sip:orig@scscf.ims.mnc001.mcc001.3gppnetwork.org:6060;lr>
Event: message-summary
Accept: application/simple-message-summary
Allow-Events: refer, presence, presence.winfo, xcap-diff, conference
Allow: INVITE, ACK, CANCEL, BYE, MESSAGE, OPTIONS, NOTIFY, PRACK, UPDATE, REFER
Privacy: none
P-Access-Network-Info: ADSL;utran-cell-id-3gpp=00000000
User-Agent: IM-client/OMA1.0 Boghe-Win32/v2.0.153.836

................
06:34:23.255929 IP 10.0.3.2.49178 > 192.168.56.101.4060: UDP, length 842
E..f....@...
.....8e.....R..SUBSCRIBE sip:alice@ims.mnc001.mcc001.3gppnetwork.org SIP/2.0
Via: SIP/2.0/UDP 127.0.0.1:49178;branch=z9hG4bK22623420;rport
From: <sip:alice@ims.mnc001.mcc001.3gppnetwork.org>;tag=22629284
To: <sip:alice@ims.mnc001.mcc001.3gppnetwork.org>
Contact: <sip:alice@127.0.0.1:49178;transport=udp>;+g.oma.sip-im;language="en,fr"
Call-ID: 988b1427-88f8-406d-1454-aeff7304dddb
CSeq: 24466 SUBSCRIBE
Expires: 600000
Content-Length: 0
Max-Forwards: 70
Route: <sip:orig@scscf.ims.mnc001.mcc001.3gppnetwork.org:6060;lr>
Event: reg
Accept: application/reginfo+xml
Allow-Events: refer, presence, presence.winfo, xcap-diff, conference
Allow: INVITE, ACK, CANCEL, BYE, MESSAGE, OPTIONS, NOTIFY, PRACK, UPDATE, REFER
Privacy: none
P-Access-Network-Info: ADSL;utran-cell-id-3gpp=00000000
User-Agent: IM-client/OMA1.0 Boghe-Win32/v2.0.153.836

................
06:34:23.261932 IP 10.0.3.2.49178 > 192.168.56.101.4060: UDP, length 865
E..}....@...
.....8e.....i..SUBSCRIBE sip:alice@ims.mnc001.mcc001.3gppnetwork.org SIP/2.0
Via: SIP/2.0/UDP 127.0.0.1:49178;branch=z9hG4bK22617074;rport
From: <sip:alice@ims.mnc001.mcc001.3gppnetwork.org>;tag=22624198
To: <sip:alice@ims.mnc001.mcc001.3gppnetwork.org>
Contact: <sip:alice@127.0.0.1:49178;transport=udp>;+g.oma.sip-im;language="en,fr"
Call-ID: 58052540-fcaa-cdad-9fde-76450602aa9d
CSeq: 32393 SUBSCRIBE
Expires: 600000
Content-Length: 0
Max-Forwards: 70
Route: <sip:orig@scscf.ims.mnc001.mcc001.3gppnetwork.org:6060;lr>
Event: message-summary
Accept: application/simple-message-summary
Allow-Events: refer, presence, presence.winfo, xcap-diff, conference
Allow: INVITE, ACK, CANCEL, BYE, MESSAGE, OPTIONS, NOTIFY, PRACK, UPDATE, REFER
Privacy: none
P-Access-Network-Info: ADSL;utran-cell-id-3gpp=00000000
User-Agent: IM-client/OMA1.0 Boghe-Win32/v2.0.153.836

................

```

### Additional Information

  * **Kamailio Version** - output of `kamailio -v`

```
[root@osboxes kamailio_pcscf]# kamailio -v
version: kamailio 5.1.4 (x86_64/linux)
flags: STATS: Off, USE_TCP, USE_TLS, USE_SCTP, TLS_HOOKS, DISABLE_NAGLE, USE_MCAST, DNS_IP_HACK, SHM_MEM, SHM_MMAP, PKG_MALLOC, Q_MALLOC, F_MALLOC, TLSF_MALLOC, DBG_SR_MEMORY, USE_FUTEX, FAST_LOCK-ADAPTIVE_WAIT, USE_DNS_CACHE, USE_DNS_FAILOVER, USE_NAPTR, USE_DST_BLACKLIST, HAVE_RESOLV_RES
ADAPTIVE_WAIT_LOOPS=1024, MAX_RECV_BUFFER_SIZE 262144, MAX_LISTEN 16, MAX_URI_SIZE 1024, BUF_SIZE 65535, DEFAULT PKG_SIZE 8MB
poll method support: poll, epoll_lt, epoll_et, sigio_rt, select.
id: unknown
compiled on 01:00:45 Jun  7 2018 with gcc 4.8.5

```

* **Operating System**:

```
[root@osboxes kamailio_pcscf]# uname -a
Linux osboxes 3.10.0-862.3.2.el7.x86_64 #1 SMP Mon May 21 23:36:36 UTC 2018 x86_64 x86_64 x86_64 GNU/Linux

```

**Comment by linuxmaniac** [comment]
@uts09 can you try that fix?

**Comment by uts09** [comment]
Thanks @linuxmaniac, issue is resolved!
